{
  "schema_version": "segro_customer_candidate_handoff_v1",
  "trace_id": "trg_fixture_abstained",
  "asset_record_key": null,
  "requirement_id": "req_fixture",
  "target_id": "trg_fixture_abstained",
  "field_name": "fixture_abstained_field",
  "customer_field_label": null,
  "display_value": null,
  "status": "abstained",
  "reason_code": "insufficient_attribute_evidence",
  "caveat": null,
  "source_reference": {
    "source_id": "src_fixture",
    "source_file": "fixture.pdf",
    "page_number": 3,
    "source_url": null,
    "source_url_status": "mapping_required"
  },
  "internal_record_identity": "run_fixture:trg_fixture_abstained",
  "transformation_status": "not_promotable"
}

